Text,Subject,Object,Domain,Range
"CVE-2016-3454 Unspecified vulnerability in the Java VM component in Oracle Database Server 11.2.0.4 , 12.1.0.1 , and 12.1.0.2 allows remote attackers to affect confidentiality, integrity, and availability via unknown vectors . ",Unspecified vulnerability ,remote attackers ,Vulnerability,Attacker
"CVE-2016-3455 Unspecified vulnerability in the Oracle Outside In Technology component in Oracle Fusion Middleware 8.5.0 , 8.5.1 , and 8.5.2 allows remote attackers to affect confidentiality, integrity, and availability via vectors related to Outside In Filters . ",Unspecified vulnerability ,remote attackers ,Vulnerability,Attacker
"CVE-2016-3456 Unspecified vulnerability in the Oracle Complex Maintenance , Repair , and Overhaul component in Oracle Supply Chain Products Suite 12.1.1 , 12.1.2 , and 12.1.3 allows remote attackers to affect confidentiality and integrity via vectors related to Dialog Box . ",Unspecified vulnerability ,remote attackers ,Vulnerability,Attacker
CVE-2016-3457 Unspecified vulnerability in the PeopleSoft Enterprise HCM ePerformance component in Oracle PeopleSoft Products 9.2 allows remote authenticated users to affect confidentiality and integrity via vectors related to Security . ,Unspecified vulnerability ,remote authenticated users ,Vulnerability,Attacker
"CVE-2016-3458 Unspecified vulnerability in Oracle Java SE 6u115 , 7u101 , and 8u92; and Java SE Embedded 8u91 allows remote attackers to affect integrity via vectors related to CORBA . ",Unspecified vulnerability ,remote attackers ,Vulnerability,Attacker
CVE-2016-3459 Unspecified vulnerability in Oracle MySQL 5.6.30 and earlier and 5.7.12 and earlier and MariaDB 10.0.x before 10.0.25 and 10.1.x before 10.1.14 allows remote administrators to affect availability via vectors related to Server : InnoDB . ,Unspecified vulnerability ,remote administrators ,Vulnerability,Attacker
CVE-2016-3460 Unspecified vulnerability in the PeopleSoft Enterprise HCM component in Oracle PeopleSoft Products 9.2 allows remote authenticated users to affect confidentiality and integrity via vectors related to ePerformance . ,Unspecified vulnerability ,remote authenticated users ,Vulnerability,Attacker
"CVE-2016-3461 Unspecified vulnerability in the MySQL Enterprise Monitor component in Oracle MySQL 3.0.25 and earlier and 3.1.2 and earlier allows remote administrators to affect confidentiality, integrity, and availability via vectors related to Monitoring : Server . ",Unspecified vulnerability ,remote administrators ,Vulnerability,Attacker
CVE-2016-3462 Unspecified vulnerability in Oracle Sun Solaris 11.3 allows local users to affect availability via vectors related to Network Configuration Service . ,Unspecified vulnerability ,local users ,Vulnerability,Attacker
CVE-2016-3463 Unspecified vulnerability in the Oracle FLEXCUBE Direct Banking component in Oracle Financial Services Software 12.0.3 allows remote attackers to affect confidentiality and integrity via vectors related to Pre-Login . ,Unspecified vulnerability ,remote attackers ,Vulnerability,Attacker
CVE-2016-3464 Unspecified vulnerability in the Oracle FLEXCUBE Direct Banking component in Oracle Financial Services Software 12.0.3 allows remote authenticated users to affect confidentiality via vectors related to Accounts . ,Unspecified vulnerability ,remote authenticated users ,Vulnerability,Attacker
CVE-2016-3465 Unspecified vulnerability in Oracle Sun Solaris 10 and 11.3 allows local users to affect availability via vectors related to ZFS . ,Unspecified vulnerability ,local users ,Vulnerability,Attacker
"CVE-2016-3466 Unspecified vulnerability in the Oracle Field Service component in Oracle E-Business Suite 12.1.1 , 12.1.2 , and 12.1.3 allows remote attackers to affect confidentiality and integrity via vectors related to Wireless . ",Unspecified vulnerability ,remote attackers ,Vulnerability,Attacker
CVE-2016-3467 Unspecified vulnerability in the Application Express component in Oracle Database Server before 5.0.4 allows remote attackers to affect availability via unknown vectors . ,Unspecified vulnerability ,remote attackers ,Vulnerability,Attacker
"CVE-2016-3468 Unspecified vulnerability in the Oracle Agile Engineering Data Management component in Oracle Supply Chain Products Suite 6.1.3.0 and 6.2.0.0 allows remote attackers to affect confidentiality, integrity, and availability via vectors related to Install . ",Unspecified vulnerability ,remote attackers ,Vulnerability,Attacker
"CVE-2016-3469 Unspecified vulnerability in the Siebel Core - Server Framework component in Oracle Siebel CRM 8.1.1 , 8.2.2 , IP2014 , IP2015 , and IP2016 allows local users to affect confidentiality via vectors related to Services . ",Unspecified vulnerability ,local users ,Vulnerability,Attacker
CVE-2016-3470 Unspecified vulnerability in the Oracle Transportation Management component in Oracle Supply Chain Products Suite 6.4.1 allows remote authenticated users to affect confidentiality and integrity via vectors related to Install . ,Unspecified vulnerability ,remote authenticated users ,Vulnerability,Attacker
"CVE-2016-3471 Unspecified vulnerability in Oracle MySQL 5.5.45 and earlier and 5.6.26 and earlier allows local users to affect confidentiality, integrity, and availability via vectors related to Server : Option . ",Unspecified vulnerability ,local users ,Vulnerability,Attacker
"CVE-2016-3472 Unspecified vulnerability in the Siebel Engineering - Installer and Deployment component in Oracle Siebel CRM 8.1.1 , 8.2.2 , IP2014 , IP2015 , and IP2016 allows remote authenticated users to affect confidentiality via vectors related to Web Server . ",Unspecified vulnerability ,remote authenticated users ,Vulnerability,Attacker
"CVE-2016-3473 Unspecified vulnerability in the BI Publisher (formerly XML Publisher) component in Oracle Fusion Middleware 11.1.1.7.0 , 11.1.1.9.0 , and 12.2.1.0.0 allows remote authenticated users to affect confidentiality via unknown vectors . ",Unspecified vulnerability ,remote authenticated users ,Vulnerability,Attacker
CVE-2016-3475 Unspecified vulnerability in the Oracle Knowledge component in Oracle Siebel CRM 8.5.x allows remote authenticated users to affect confidentiality via vectors related to Information Manager Console . ,Unspecified vulnerability ,remote authenticated users ,Vulnerability,Attacker
CVE-2016-3476 Unspecified vulnerability in the Oracle Knowledge component in Oracle Siebel CRM 8.5.x allows remote attackers to affect confidentiality and integrity via vectors related to Information Manager Console . ,Unspecified vulnerability ,remote attackers ,Vulnerability,Attacker
"CVE-2016-3477 Unspecified vulnerability in Oracle MySQL 5.5.49 and earlier, 5.6.30 and earlier, and 5.7.12 and earlier and MariaDB before 5.5.50, 10.0.x before 10.0.26 , and 10.1.x before 10.1.15 allows local users to affect confidentiality, integrity, and availability via vectors related to Server : Parser. ",Unspecified vulnerability ,local users ,Vulnerability,Attacker
"CVE-2016-3478 Unspecified vulnerability in the PeopleSoft Enterprise PeopleTools component in Oracle PeopleSoft Products 8.53 , 8.54 , and 8.55 allows remote attackers to affect confidentiality and integrity via vectors related to File Processing . ",Unspecified vulnerability ,remote attackers ,Vulnerability,Attacker
CVE-2016-3479 Unspecified vulnerability in the Portable Clusterware component in Oracle Database Server 11.2.0.4 and 12.1.0.2 allows remote attackers to affect availability via unknown vectors . ,Unspecified vulnerability ,remote attackers ,Vulnerability,Attacker
CVE-2016-3480 Unspecified vulnerability in the Solaris Cluster component in Oracle Sun Systems Products Suite 3.3 and 4.3 allows local users to affect confidentiality via vectors related to HA for Postgresql . ,Unspecified vulnerability ,local users ,Vulnerability,Attacker
"CVE-2016-3481 Unspecified vulnerability in the ILOM component in Oracle Sun Systems Products Suite 3.0 , 3.1 , and 3.2 allows remote authenticated users to affect availability via vectors related to Web . ",Unspecified vulnerability ,remote authenticated users ,Vulnerability,Attacker
CVE-2016-3482 Unspecified vulnerability in the Oracle HTTP Server component in Oracle Fusion Middleware 11.1.1.9 and 12.1.3.0 allows remote attackers to affect confidentiality via vectors related to SSL/TLS Module . ,Unspecified vulnerability ,remote attackers ,Vulnerability,Attacker
"CVE-2016-3483 Unspecified vulnerability in the PeopleSoft Enterprise PeopleTools component in Oracle PeopleSoft Products 8.53 , 8.54 , and 8.55 allows remote attackers to affect confidentiality and availability via vectors related to File Processing . ",Unspecified vulnerability ,remote attackers ,Vulnerability,Attacker
"CVE-2016-3484 Unspecified vulnerability in the Database Vault component in Oracle Database Server 11.2.0.4 , 12.1.0.1 , and 12.1.0.2 allows local users to affect confidentiality and integrity via unknown vectors . ",Unspecified vulnerability ,local users ,Vulnerability,Attacker
"CVE-2016-3485 Unspecified vulnerability in Oracle Java SE 6u115 , 7u101 , and 8u92; Java SE Embedded 8u91; and JRockit R28.3.10 allows local users to affect integrity via vectors related to Networking . ",Unspecified vulnerability ,local users ,Vulnerability,Attacker
CVE-2016-3486 Unspecified vulnerability in Oracle MySQL 5.6.30 and earlier and 5.7.12 and earlier allows remote authenticated users to affect availability via vectors related to Server : FTS. ,Unspecified vulnerability ,remote authenticated users ,Vulnerability,Attacker
"CVE-2016-3487 Unspecified vulnerability in the Oracle WebCenter Sites component in Oracle Fusion Middleware 11.1.1.8 , and 12.2.1.0 allows remote attackers to affect confidentiality, integrity, and availability via unknown vectors . ",Unspecified vulnerability ,remote attackers ,Vulnerability,Attacker
CVE-2016-3488 Unspecified vulnerability in the DB Sharding component in Oracle Database Server 12.1.0.2 allows local users to affect integrity via unknown vectors . ,Unspecified vulnerability ,local users ,Vulnerability,Attacker
"CVE-2016-3489 Unspecified vulnerability in the Data Pump Import component in Oracle Database Server 11.2.0.4 , 12.1.0.1 , and 12.1.0.2 allows local users to affect confidentiality, integrity, and availability via unknown vectors . ",Unspecified vulnerability ,local users ,Vulnerability,Attacker
"CVE-2016-3490 Unspecified vulnerability in the Oracle Transportation Management component in Oracle Supply Chain Products Suite 6.3.0 , 6.3.1 , 6.3.2 , 6.3.3 , 6.3.4 , 6.3.5 , 6.3.6 , 6.3.7 , 6.4.0 , and 6.4.1 allows remote authenticated users to affect confidentiality via vectors related to Database . ",Unspecified vulnerability ,remote authenticated users ,Vulnerability,Attacker
"CVE-2016-3491 Unspecified vulnerability in the Oracle CRM Technical Foundation component in Oracle E-Business Suite 12.1.3 allows remote attackers to affect confidentiality and integrity via vectors related to Wireless Framework . NOTE: the previous information is from the July 2016 CPU. Oracle has not commented on third-party claims that this issue is a cross-site scripting (XSS) vulnerability, which allows remote attackers to inject arbitrary web script or HTML via unspecified vectors. ",Unspecified vulnerability ,remote attackers ,Vulnerability,Attacker
"CVE-2016-3492 Unspecified vulnerability in Oracle MySQL 5.5.51 and earlier, 5.6.32 and earlier, and 5.7.14 and earlier allows remote authenticated users to affect availability via vectors related to Server : Optimizer . ",Unspecified vulnerability ,remote authenticated users ,Vulnerability,Attacker
CVE-2016-3495 Unspecified vulnerability in Oracle MySQL 5.7.13 and earlier allows remote administrators to affect availability via vectors related to Server : InnoDB . ,Unspecified vulnerability ,remote administrators ,Vulnerability,Attacker
"CVE-2016-3497 Unspecified vulnerability in Oracle Sun Solaris 11.3 allows local users to affect availability via vectors related to Kernel , a different vulnerability than CVE-2016-5469 and CVE-2016-5471. ",Unspecified vulnerability ,local users ,Vulnerability,Attacker
"CVE-2016-3500 Unspecified vulnerability in Oracle Java SE 6u115 , 7u101 , and 8u92; Java SE Embedded 8u91; and JRockit R28.3.10 allows remote attackers to affect availability via vectors related to JAXP , a different vulnerability than CVE-2016-3508. ",Unspecified vulnerability ,remote attackers ,Vulnerability,Attacker
CVE-2016-3501 Unspecified vulnerability in Oracle MySQL 5.6.30 and earlier and 5.7.12 and earlier allows remote authenticated users to affect availability via vectors related to Server : Optimizer . ,Unspecified vulnerability ,remote authenticated users ,Vulnerability,Attacker
"CVE-2016-3502 Unspecified vulnerability in the Oracle WebCenter Sites component in Oracle Fusion Middleware 11.1.1.8 and 12.2.1.0 allows remote authenticated users to affect confidentiality , integrity , and availability via unknown vectors . ",Unspecified vulnerability ,remote authenticated users ,Vulnerability,Attacker
"CVE-2016-3503 Unspecified vulnerability in Oracle Java SE 6u115 , 7u101 , and 8u92 allows local users to affect confidentiality , integrity , and availability via vectors related to Install . ",Unspecified vulnerability ,local users ,Vulnerability,Attacker
"CVE-2016-3505 Unspecified vulnerability in the Oracle WebLogic Server component in Oracle Fusion Middleware 10.3.6.0 , 12.1.3.0 , and 12.2.1.0 allows remote authenticated users to affect confidentiality , integrity , and availability via vectors related to JavaServer Faces . ",Unspecified vulnerability ,remote authenticated users ,Vulnerability,Attacker
"CVE-2016-3506 Unspecified vulnerability in the JDBC component in Oracle Database Server 11.2.0.4 , 12.1.0.1 , and 12.1.0.2 allows remote attackers to affect confidentiality , integrity , and availability via unknown vectors . ",Unspecified vulnerability ,remote attackers ,Vulnerability,Attacker
"CVE-2016-3508 Unspecified vulnerability in Oracle Java SE 6u115 , 7u101 , and 8u92; Java SE Embedded 8u91; and JRockit R28.3.10 allows remote attackers to affect availability via vectors related to JAXP , a different vulnerability than CVE-2016-3500. ",Unspecified vulnerability ,remote attackers ,Vulnerability,Attacker
CVE-2016-3509 Unspecified vulnerability in the Oracle Agile PLM component in Oracle Supply Chain Products Suite 9.3.4 and 9.3.5 allows remote authenticated users to affect confidentiality and integrity via vectors related to File Folders / URL Attachment . ,Unspecified vulnerability ,remote authenticated users ,Vulnerability,Attacker
"CVE-2016-3510 Unspecified vulnerability in the Oracle WebLogic Server component in Oracle Fusion Middleware 10.3.6.0 , 12.1.3.0 , and 12.2.1.0 allows remote attackers to affect confidentiality , integrity , and availability via vectors related to WLS Core Components , a different vulnerability than CVE-2016-3586. ",Unspecified vulnerability ,remote attackers ,Vulnerability,Attacker
"CVE-2016-3511 Unspecified vulnerability in Oracle Java SE 7u101 and 8u92 allows local users to affect confidentiality , integrity , and availability via vectors related to Deployment . ",Unspecified vulnerability ,local users ,Vulnerability,Attacker
"CVE-2016-3512 Unspecified vulnerability in the Oracle Customer Interaction History component in Oracle E-Business Suite 12.1.1 , 12.1.2 , and 12.1.3 allows remote attackers to affect confidentiality and integrity via vectors related to Function Security . ",Unspecified vulnerability ,remote ,Vulnerability,Attacker
CVE-2016-3513 Unspecified vulnerability in the Oracle Communications Operations Monitor component in Oracle Communications Applications before 3.3.92.0.0 allows remote authenticated users to affect confidentiality via vectors related to Infrastructure . ,Unspecified vulnerability ,remote authenticated users ,Vulnerability,Attacker
"CVE-2016-3514 Unspecified vulnerability in the Oracle Enterprise Communications Broker component in Oracle Communications Applications before PCz 2.0.0m4p1 allows remote authenticated users to affect confidentiality via vectors related to GUI , a different vulnerability than CVE-2016-3516. ",Unspecified vulnerability ,remote authenticated users ,Vulnerability,Attacker
CVE-2016-3515 Unspecified vulnerability in the Oracle Enterprise Communications Broker component in Oracle Communications Applications before PCz 2.0.0m4p1 allows remote attackers to affect confidentiality via unknown vectors . ,Unspecified vulnerability ,remote attackers ,Vulnerability,Attacker
"CVE-2016-3516 Unspecified vulnerability in the Oracle Enterprise Communications Broker component in Oracle Communications Applications before PCz 2.0.0m4p 1 allows remote authenticated users to affect confidentiality via vectors related to GUI , a different vulnerability than CVE-2016-3514. ",Unspecified vulnerability ,remote authenticated users ,Vulnerability,Attacker
CVE-2016-3517 Unspecified vulnerability in the Oracle Agile PLM component in Oracle Supply Chain Products Suite 9.3.4 and 9.3.5 allows remote attackers to affect integrity via vectors related to PC / Get Shortcut. ,Unspecified vulnerability ,remote attackers ,Vulnerability,Attacker
CVE-2016-3518 Unspecified vulnerability in Oracle MySQL 5.7.12 and earlier allows remote authenticated users to affect availability via vectors related to Server : Optimizer. ,Unspecified vulnerability ,remote authenticated users ,Vulnerability,Attacker
CVE-2016-3519 Unspecified vulnerability in the Oracle Agile PLM component in Oracle Supply Chain Products Suite 9.3.4 and 9.3.5 allows remote attackers to affect confidentiality and integrity via vectors related to PC / Get Shortcut. ,Unspecified vulnerability ,remote attackers ,Vulnerability,Attacker
"CVE-2016-3520 Unspecified vulnerability in the Oracle Application Object Library component in Oracle E-Business Suite 12.1.3 , 12.2.3 , 12.2.4 , and 12.2.5 allows remote administrators to affect confidentiality via vectors related to AOL Diagnostic tests . ",Unspecified vulnerability ,remote administrators ,Vulnerability,Attacker
"CVE-2016-3521 Unspecified vulnerability in Oracle MySQL 5.5.49 and earlier, 5.6.30 and earlier, and 5.7.12 and earlier and MariaDB before 5.5.50, 10.0.x before 10.0.26 , and 10.1.x before 10.1.15 allows remote authenticated users to affect availability via vectors related to Server : Types. ",Unspecified vulnerability ,remote authenticated users ,Vulnerability,Attacker
"CVE-2016-3522 Unspecified vulnerability in the Oracle Web Applications Desktop Integrator component in Oracle E-Business Suite 12.1.3 , 12.2.3 , 12.2.4 , and 12.2.5 allows remote attackers to affect confidentiality and integrity via vectors related to Application Service . ",Unspecified vulnerability ,remote attackers ,Vulnerability,Attacker
"CVE-2016-3523 Unspecified vulnerability in the Oracle Web Applications Desktop Integrator component in Oracle E-Business Suite 12.1.3 , 12.2.3 , 12.2.4 , and 12.2.5 allows remote attackers to affect integrity via vectors related to Application Service . ",Unspecified vulnerability ,remote attackers ,Vulnerability,Attacker
"CVE-2016-3524 Unspecified vulnerability in the Oracle Applications Technology Stack component in Oracle E-Business Suite 12.1.3 , 12.2.3 , 12.2.4 , and 12.2.5 allows remote attackers to affect confidentiality and integrity via vectors related to Configuration . ",Unspecified vulnerability ,remote attackers ,Vulnerability,Attacker
CVE-2016-3525 Unspecified vulnerability in the Oracle Applications Manager component in Oracle E-Business Suite 12.1.3 allows remote attackers to affect confidentiality via vectors related to Cookie Management . ,Unspecified vulnerability ,remote attackers ,Vulnerability,Attacker
"CVE-2016-3526 Unspecified vulnerability in the Oracle Agile PLM component in Oracle Supply Chain Products Suite 9.3.4 and 9.3.5 allows remote attackers to affect confidentiality via vectors related to SDK , a different vulnerability than CVE-2016-3529 and CVE-2016-3560. ",Unspecified vulnerability ,remote attackers ,Vulnerability,Attacker
CVE-2016-3527 Unspecified vulnerability in the Oracle Demand Planning component in Oracle Supply Chain Products Suite 12.1 and 12.2 allows remote attackers to affect confidentiality and integrity via vectors related to ODPDA Servlet . ,Unspecified vulnerability ,remote attackers ,Vulnerability,Attacker
"CVE-2016-3528 Unspecified vulnerability in the Oracle Internet Expenses component in Oracle E-Business Suite 12.1.1 , 12.1.2 , 12.1.3 , 12.2.3 , 12.2.4 , and 12.2.5 allows remote attackers to affect availability via vectors related to Expenses Admin Utilities . ",Unspecified vulnerability ,remote attackers ,Vulnerability,Attacker
"CVE-2016-3529 Unspecified vulnerability in the Oracle Agile PLM component in Oracle Supply Chain Products Suite 9.3.4 and 9.3.5 allows remote attackers to affect confidentiality via vectors related to SDK , a different vulnerability than CVE-2016-3526 and CVE-2016-3560. ",Unspecified vulnerability ,remote attackers ,Vulnerability,Attacker
CVE-2016-3530 Unspecified vulnerability in the Oracle Agile PLM component in Oracle Supply Chain Products Suite 9.3.4 and 9.3.5 allows remote authenticated users to affect integrity and availability via vectors related to PGC / Import . ,Unspecified vulnerability ,remote authenticated users ,Vulnerability,Attacker
CVE-2016-3531 Unspecified vulnerability in the Oracle Agile PLM component in Oracle Supply Chain Products Suite 9.3.4 and 9.3.5 allows remote authenticated users to affect confidentiality via vectors related to PC / Notification . ,Unspecified vulnerability ,remote authenticated users ,Vulnerability,Attacker
"CVE-2016-3532 Unspecified vulnerability in the Oracle Advanced Inbound Telephony component in Oracle E-Business Suite 12.1.1 , 12.1.2 , and 12.1.3 allows remote attackers to affect confidentiality and integrity via vectors related to SDK client integration. NOTE: the previous information is from the July 2016 CPU. Oracle has not commented on third-party claims that this issue involves multiple cross-site scripting (XSS) vulnerabilities, which allow remote attackers to inject arbitrary web script or HTML via unspecified vectors . ",Unspecified vulnerability ,remote attackers ,Vulnerability,Attacker
"CVE-2016-3533 Unspecified vulnerability in the Oracle Knowledge Management component in Oracle E-Business Suite 12.1.1 , 12.1.2 , 12.1.3 , 12.2.3 , 12.2.4 , and 12.2.5 allows remote attackers to affect integrity via vectors related to Search. NOTE: the previous information is from the July 2016 CPU. Oracle has not commented on third-party claims that this issue involves multiple open redirect vulnerabilities, which allow remote attackers to redirect users to arbitrary web sites and conduct phishing attacks via unspecified vectors . ",Unspecified vulnerability ,remote attackers ,Vulnerability,Attacker
"CVE-2016-3534 Unspecified vulnerability in the Oracle Installed Base component in Oracle E-Business Suite 12.1.1 , 12.1.2 , 12.1.3, 12.2.3, 12.2.4, and 12.2.5 allows remote attackers to affect integrity via vectors related to Engineering Change Order. NOTE: the previous information is from the July 2016 CPU. Oracle has not commented on third-party claims that this issue involves an open redirect vulnerability, which allows remote attackers to redirect users to arbitrary web sites and conduct phishing attacks via unspecified vectors . ",Unspecified vulnerability ,remote attackers ,Vulnerability,Attacker
"CVE-2016-3536 Unspecified vulnerability in the Oracle Marketing component in Oracle E-Business Suite 12.1.1 , 12.1.2 , and 12.1.3 allows remote attackers to affect confidentiality and integrity via vectors related to Deliverables. NOTE: the previous information is from the July 2016 CPU. Oracle has not commented on third-party claims that this issue involves multiple cross-site scripting (XSS) vulnerabilities, which allow remote attackers to inject arbitrary web script or HTML via unspecified vectors . ",Unspecified vulnerability ,remote attackers ,Vulnerability,Attacker
"CVE-2016-3537 Unspecified vulnerability in the Oracle Agile PLM component in Oracle Supply Chain Products Suite 9.3.4 and 9.3.5 allows remote authenticated users to affect confidentiality via vectors related to File Folders / Attachment, a different vulnerability than CVE-2016-5473. ",Unspecified vulnerability ,remote authenticated users ,Vulnerability,Attacker
"CVE-2016-3538 Unspecified vulnerability in the Oracle Agile PLM component in Oracle Supply Chain Products Suite 9.3.4 and 9.3.5 allows remote authenticated users to affect integrity and availability via vectors related to File Folders / Attachment, a different vulnerability than CVE-2016-3539. ",Unspecified vulnerability ,remote authenticated users ,Vulnerability,Attacker
"CVE-2016-3539 Unspecified vulnerability in the Oracle Agile PLM component in Oracle Supply Chain Products Suite 9.3.4 and 9.3.5 allows remote authenticated users to affect integrity and availability via vectors related to File Folders / Attachment, a different vulnerability than CVE-2016-3538. ",Unspecified vulnerability ,remote authenticated users ,Vulnerability,Attacker
CVE-2016-3540 Unspecified vulnerability in the Enterprise Manager Base Platform component in Oracle Enterprise Manager Grid Control 12.1.0.5 and 13.1.0.0 allows remote attackers to affect confidentiality via vectors related to UI Framework . ,Unspecified vulnerability ,remote attackers ,Vulnerability,Attacker
