Text,Subject,Object,Domain,Range
CVE-2014-100019 SQL injection vulnerability in the LTree converter in Pomm before 1.1.5 allows remote attackers to execute arbitrary SQL commands via unspecified vectors . ,SQL injection vulnerability ,remote attackers ,Vulnerability,Attacker
CVE-2014-100020 SQL injection vulnerability in ChangeEmail.php in iTechClassifieds 3.03.057 allows remote attackers to execute arbitrary SQL commands via the PreviewNum parameter . NOTE: the CatID parameter is already covered by CVE-2008-0685. ,SQL injection vulnerability ,remote attackers ,Vulnerability,Attacker
CVE-2014-100022 SQL injection vulnerability in question.php in the mTouch Quiz before 3.0.7 for WordPress allows remote attackers to execute arbitrary SQL commands via the quiz parameter to wp-admin/edit.php . ,SQL injection vulnerability ,remote attackers ,Vulnerability,Attacker
CVE-2014-100024 Cross-site scripting ( XSS ) vulnerability in Seo Panel before 3.4.0 allows remote attackers to inject arbitrary web script or HTML via unspecified vectors . ,Cross-site scripting ( XSS ) vulnerability ,remote attackers ,Vulnerability,Attacker
CVE-2014-100026 Cross-site scripting ( XSS ) vulnerability in readme.php in the April 's Super Functions Pack plugin before 1.4.8 for WordPress allows remote attackers to inject arbitrary web script or HTML via the page parameter . NOTE: some of these details are obtained from third party information. ,Cross-site scripting ( XSS ) vulnerability ,remote attackers ,Vulnerability,Attacker
CVE-2014-100028 Cross-site scripting ( XSS ) vulnerability in /signup in WEBCrafted allows remote attackers to inject arbitrary web script or HTML via the username . ,Cross-site scripting ( XSS ) vulnerability ,remote attackers ,Vulnerability,Attacker
CVE-201 4 -10003 Multiple cross-site scripting ( XSS ) vulnerabilities in Maian Uploader 4 .0 allow remote attackers to inject arbitrary web script or HTML via the width parameter to (1) uploader/admin/js/load or (2) uploader/js/load ,Multiple cross-site scripting ( XSS ) vulnerabilities ,remote attackers ,Vulnerability,Attacker
CVE-2014-100031 Multiple SQL injection vulnerabilities in Ganesha Digital Library ( GDL ) 4.2 allow remote attackers to execute arbitrary SQL commands via the id parameter in (1) download.php or (2) main.php. ,Multiple SQL injection vulnerabilities ,remote attackers ,Vulnerability,Attacker
CVE-2014-100033 Directory traversal vulnerability in LicensePal ArcticDesk before 1.2.5 allows remote attackers to read arbitrary files via unspecified vectors . ,Directory traversal vulnerability ,remote attackers ,Vulnerability,Attacker
CVE-2014-100035 SQL injection vulnerability in the ticket grid in the admin interface in LicensePal ArcticDesk before 1.2.5 allows remote attackers to execute arbitrary SQL commands via unspecified vectors . ,SQL injection vulnerability ,remote attackers ,Vulnerability,Attacker
CVE-2014-100037 Cross-site scripting ( XSS ) vulnerability in Storytlr 1.3.dev and earlier allows remote attackers to inject arbitrary web script or HTML via the PATH INFO to archives /. ,Cross-site scripting ( XSS ) vulnerability ,remote attackers ,Vulnerability,Attacker
CVE-201 4 -10006 Multiple cross-site request forgery ( CSRF ) vulnerabilities in Maian Uploader 4 .0 allow remote attackers to hijack the authentication of unspecified users for requests that conduct cross-site scripting ( XSS ) attacks via the width parameter to (1) uploader/admin/js/load or (2) uploader/js/load ,Multiple cross-site request forgery ( CSRF ) vulnerabilities ,remote attackers ,Vulnerability,Attacker
"CVE-20 1 4- 1 0008 Multiple cross-site request forgery ( CSRF ) vulnerabilities in Stark CRM 1 .0 allow remote attackers to hijack the authentication of administrators for requests that add ( 1 ) an administrator via a crafted request to the admin page , (2) an agent via a crafted request to the agent page, (3) a sub-agent via a crafted request to the sub page, (4) a partner via a crafted request to the partner page, or (5) a client via a crafted request to the client page. ",Multiple cross-site request forgery ( CSRF ) vulnerabilities ,remote attackers ,Vulnerability,Attacker
CVE- 2 014-10010 Directory traversal vulnerability in PHPJabbers Appointment Scheduler 2 .0 allows remote attackers to read arbitrary files via a .. (dot dot) in the id parameter in a pjActionDownload action to the pjBackup controller. ,Directory traversal vulnerability ,remote attackers ,Vulnerability,Attacker
CVE-2014-10012 Cross-site scripting ( XSS ) vulnerability in the Another WordPress Classifieds Plugin plugin for WordPress allows remote attackers to inject arbitrary web script or HTML via the query string to the default URI . ,Cross-site scripting ( XSS ) vulnerability ,remote attackers ,Vulnerability,Attacker
CVE- 2 014-10014 Multiple cross-site request forgery ( CSRF ) vulnerabilities in PHPJabbers Event Booking Calendar 2 .0 allow remote attackers to hijack the authentication of administrators for requests that (1) change the username and password of the administrator via an update action to the AdminOptions controller or conduct cross-site scripting (XSS) attacks via the ( 2 ) event title parameter in a create action to the AdminEvents controller or (3) category title parameter in a create action to the AdminCategories controller . ,Multiple cross-site request forgery ( CSRF ) vulnerabilities ,remote attackers ,Vulnerability,Attacker
"CVE-2014-10016 Multiple cross-site scripting ( XSS ) vulnerabilities in the Welcart e-Commerce plugin 1.3.12 for WordPress allow remote attackers to inject arbitrary web script or HTML via (1) unspecified vectors related to purchase limit or the (2) name, (3) intl, (4) nocod, or (5) time parameter in an add delivery action to wp-admin/admin-ajax.php. ",Multiple cross-site scripting ( XSS ) vulnerabilities ,remote attackers ,Vulnerability,Attacker
CVE-2014-10018 Cross-site scripting ( XSS ) vulnerability in webconfig/wlan/country.html/country in the Teracom T2-B-Gawv1.4U10Y-BI modem allows remote attackers to inject arbitrary web script or HTML via the essid parameter . ,Cross-site scripting ( XSS ) vulnerability ,remote attackers ,Vulnerability,Attacker
CVE-2014-10020 SQL injection vulnerability in login.php in Simple e-document 1.31 allows remote attackers to execute arbitrary SQL commands via the username parameter . ,SQL injection vulnerability ,remote attackers ,Vulnerability,Attacker
CVE-2014-10028 Cross-site scripting ( XSS ) vulnerability in D-Link DAP-1360 router with firmware 2.5.4 and later allows remote attackers to inject arbitrary web script or HTML via the res buf parameter to index.cgi when res config is set to 41. ,Cross-site scripting ( XSS ) vulnerability ,remote attackers ,Vulnerability,Attacker
CVE-2014-10030 Open redirect vulnerability in forums/login.php in FluxBB before 1.4.13 and 1.5.x before 1.5.7 allows remote attackers to redirect users to arbitrary web sites and conduct phishing attacks via a URL in the redirect url parameter . ,Open redirect vulnerability ,remote attackers ,Vulnerability,Attacker
CVE-20 1 4- 1 0032 SQL injection vulnerability in news popup.php in Taboada MacroNews 1 .0 allows remote authenticated users to execute arbitrary SQL commands via the id parameter . ,SQL injection vulnerability ,remote authenticated users ,Vulnerability,Attacker
CVE-2014-10034 Multiple SQL injection vulnerabilities in the admin area in couponPHP before 1.2.0 allow remote administrators to execute arbitrary SQL commands via the (1) iDisplayLength or (2) iDisplayStart parameter to (a) comments or (b) stores in admin/ajax/. ,Multiple SQL injection vulnerabilities ,remote administrators ,Vulnerability,Attacker
CVE-2014-10036 Cross-site scripting ( XSS ) vulnerability in JetBrains TeamCity before 8.1 allows remote attackers to inject arbitrary web script or HTML via the cameFromUrl parameter to feed/generateFeedUrl.html. ,Cross-site scripting ( XSS ) vulnerability ,remote attackers ,Vulnerability,Attacker
CVE-2014-10038 SQL injection vulnerability in agenda/indexdate.php in DomPHP 0.83 and earlier allows remote attackers to execute arbitrary SQL commands via the ids parameter . ,execute arbitrary SQL commands via the ids parameter ,remote attackers ,Vulnerability,Attacker
CVE-2014-1204 SQL injection vulnerability in Tableau Server 8.0.x before 8.0.7 and 8.1.x before 8.1.2 allows remote authenticated users to execute arbitrary SQL commands via unspecified vectors . NOTE: this can be exploited by unauthenticated remote attackers if the guest user is enabled . ,SQL injection vulnerability ,remote authenticated users ,Vulnerability,Attacker
CVE-2014-1206 SQL injection vulnerability in the password reset page in Open Web Analytics ( OWA ) before 1.5.5 allows remote attackers to execute arbitrary SQL commands via the owa email address parameter in a base.passwordResetRequest action to index.php . ,SQL injection vulnerability ,remote attackers ,Vulnerability,Attacker
"CVE-2014-1222 Directory traversal vulnerability in kcfinder/browse.php in Vtiger CRM before 6.0.0 Security patch 1 allows remote authenticated users to read arbitrary files via a .. (dot dot) in the file parameter in a download action . NOTE: it is likely that this issue is actually in the KCFinder third-party component, and it affects additional products besides Vtiger CRM . ",Directory traversal vulnerability ,remote authenticated users ,Vulnerability,Attacker
CVE-2014-1224 Incomplete blacklist vulnerability in the user registration feature in rexx Recruitment R6.1 and R7 without `` fixes from 2014-01-15 '' allows remote attackers to conduct cross-site scripting (XSS) attacks via the oninput event handler in the fname parameter to the default URI in /reg. ,Incomplete blacklist vulnerability ,remote attackers ,Vulnerability,Attacker
CVE-2014-1232 Cross-site scripting ( XSS ) vulnerability in the Foliopress WYSIWYG plugin before 2.6.8.5 for WordPress allows remote attackers to inject arbitrary web script or HTML via unspecified vectors . ,Cross-site scripting ( XSS ) vulnerability ,remote attackers ,Vulnerability,Attacker
CVE-2014-1237 Cross-site scripting ( XSS ) vulnerability in synetics i-doit pro before 1.2.4 allows remote attackers to inject arbitrary web script or HTML via the call parameter . ,Cross-site scripting ( XSS ) vulnerability ,remote attackers ,Vulnerability,Attacker
"CVE-2014-1243 Apple QuickTime before 7.7.5 does not initialize an unspecified pointer , which allows remote attackers to execute arbitrary code or cause a denial of service (application crash) via a crafted track list in a movie file . ",does not initialize an unspecified pointer ,remote attackers ,Vulnerability,Attacker
CVE-2014-1245 Integer signedness error in Apple QuickTime before 7.7.5 allows remote attackers to execute arbitrary code or cause a denial of service (application crash) via a crafted stsz atom in a movie file . ,Integer signedness error ,remote attackers ,Vulnerability,Attacker
CVE-2014-1249 Buffer overflow in Apple QuickTime before 7.7.5 allows remote attackers to execute arbitrary code or cause a denial of service ( application crash ) via a crafted PSD image . ,crafted PSD image ,remote attackers ,Vulnerability,Attacker
CVE-2014-1253 AppleMNT.sys in Apple Boot Camp 5 before 5.1 allows local users to cause a denial of service ( kernel memory corruption ) or possibly have unspecified other impact via a malformed header in a Portable Executable ( PE ) file . ,AppleMNT.sys ,local users ,Vulnerability,Attacker
"CVE-2014-1257 CFNetwork in Apple OS X through 10.8.5 does not remove session cookies upon a Safari reset action , which allows physically proximate attackers to bypass intended access restrictions by leveraging an unattended workstation. ",does not remove session cookies upon a Safari reset action ,physically proximate attackers ,Vulnerability,Attacker
CVE-2014-1261 Integer signedness error in CoreText in Apple OS X before 10.9.2 allows remote attackers to execute arbitrary code or cause a denial of service ( application crash ) via a crafted Unicode font. ,Integer signedness error ,remote attackers ,Vulnerability,Attacker
"CVE-2014-1263 curl and libcurl 7.27.0 through 7.35.0 , when using the SecureTransport/Darwinssl backend , as used in in Apple OS X 10.9.x before 10.9.2, does not verify that the server hostname matches a domain name in the subject 's Common Name ( CN ) or subjectAltName field of the X.509 certificate when accessing a URL that uses a numerical IP address , which allows man-in-the-middle attackers to spoof servers via an arbitrary valid certificate . ",does not verify that the server hostname matches a domain name in the subject 's Common Name ( CN ) or subjectAltName field of the X.509 certificate when accessing a URL that uses a numerical IP address ,man-in-the-middle attackers ,Vulnerability,Attacker
CVE-2014-1265 The systemsetup program in the Date and Time subsystem in Apple OS X before 10.9.2 allows local users to bypass intended access restrictions by changing the current time on the system clock. ,systemsetup program ,local users ,Vulnerability,Attacker
CVE-2014-1275 Buffer overflow in ImageIO in Apple iOS before 7.1 and Apple TV before 6.1 allows remote attackers to execute arbitrary code or cause a denial of service ( application crash ) via crafted JPEG2000 data in a PDF document . ,Buffer overflow ,remote attackers ,Vulnerability,Attacker
"CVE-2014-1289 WebKit  , as used in Apple iOS before 7.1 and Apple TV before 6.1 , allows remote attackers to execute arbitrary code or cause a denial of service (memory corruption and application crash) via a crafted web site, a different vulnerability than CVE-2014-1290, CVE-2014-1291, CVE-2014-1292, CVE-2014-1293, and CVE-2014-1294. ",WebKit ,remote attackers ,Vulnerability,Attacker
"CVE-2014-1303 Heap-based buffer overflow in Apple Safari 7.0.2 allows remote attackers to execute arbitrary code and bypass a sandbox protection mechanism via unspecified vectors, as demonstrated by Liang Chen during a Pwn2Own competition at CanSecWest 2014. ",Heap-based buffer overflow ,remote attackers ,Vulnerability,Attacker
CVE-2014-1315 Format string vulnerability in CoreServicesUIAgent in Apple OS X 10.9.x through 10.9.2 allows remote attackers to execute arbitrary code or cause a denial of service ( application crash ) via format string specifiers in a URL. ,Format string vulnerability ,remote attackers ,Vulnerability,Attacker
CVE-2014-1319 Buffer overflow in ImageIO in Apple OS X 10.9.x through 10.9.2 allows remote attackers to execute arbitrary code or cause a denial of service ( application crash ) via a crafted JPEG image. ,Buffer overflow ,remote attackers ,Vulnerability,Attacker
CVE-2014-1349 Use-after-free vulnerability in Safari in Apple iOS before 7.1.2 allows remote attackers to execute arbitrary code or cause a denial of service ( application crash ) via an invalid URL. ,Use-after-free vulnerability ,remote attackers ,Vulnerability,Attacker
"CVE-2014-1401 Multiple SQL injection vulnerabilities in AuraCMS 2.3 and earlier allow remote authenticated users to execute arbitrary SQL commands via the ( 1 ) search parameter to mod/content/content.php or ( 2 ) CLIENT IP , ( 3 ) X FORWARDED FOR , ( 4 ) X FORWARDED , ( 5 ) FORWARDED FOR , or ( 6 ) FORWARDED HTTP header to index.php . ",Multiple SQL injection vulnerabilities ,remote authenticated users ,Vulnerability,Attacker
CVE-2014-1403 Cross-site scripting ( XSS ) vulnerability in name.html in easyXDM before 2.4.19 allows remote attackers to inject arbitrary web script or HTML via the location.hash value . ,Cross-site scripting ( XSS ) vulnerability ,remote attackers ,Vulnerability,Attacker
CVE-2014-1405 Multiple open redirect vulnerabilities on the Conceptronic C54APM access point with runtime code 1.26 allow remote attackers to redirect users to arbitrary web sites and conduct phishing attacks via ( 1 ) the submit-url parameter in a Refresh action to goform/formWlSiteSurvey or ( 2 ) the wlan-url parameter to goform/formWlanSetup . ,Multiple open redirect vulnerabilities ,remote attackers ,Vulnerability,Attacker
CVE-2014-1407 Multiple cross-site scripting ( XSS ) vulnerabilities on the Conceptronic C54APM access point with runtime code 1.26 allow remote attackers to inject arbitrary web script or HTML via (1) the submit-url parameter in a Refresh action to goform/formWlSiteSurvey or (2) the wlan-url parameter to goform/formWlanSetup. ,Multiple cross-site scripting ( XSS ) vulnerabilities ,remote attackers ,Vulnerability,Attacker
CVE-2014-1419 Race condition in the power policy functions in policy-funcs in acpi-support before 0.142 allows local users to gain privileges via unspecified vectors . ,Race condition ,local users ,Vulnerability,Attacker
"CVE-2014-1445 The wanxl ioctl function in drivers/net/wan/wanxl.c in the Linux kernel before 3.11.7 does not properly initialize a certain data structure , which allows local users to obtain sensitive information from kernel memory via an ioctl call . ",wanxl ioctl function ,local users ,Vulnerability,Attacker
CVE-2014-1447 Race condition in the virNetServerClientStartKeepAlive function in libvirt before 1.2.1 allows remote attackers to cause a denial of service ( libvirt d crash ) by closing a connection before a keepalive response is sent . ,Race condition ,remote attackers ,Vulnerability,Attacker
"CVE-2014-1455 SQL injection vulnerability in the password reset functionality in Pearson eSIS Enterprise Student Information System , possibly 3.3.0.13 and earlier , allows remote attackers to execute arbitrary SQL commands via the new password . ",SQL injection vulnerability ,remote attackers ,Vulnerability,Attacker
"CVE-2014-1523 Heap-based buffer overflow in the read u32 function in Mozilla Firefox before 29.0 , Firefox ESR 24.x before 24.5 , Thunderbird before 24.5 , and SeaMonkey before 2.26 allows remote attackers to cause a denial of service ( out-of-bounds read and application crash ) via a crafted JPEG image . ",Heap-based buffer overflow ,remote attackers ,Vulnerability,Attacker
"CVE-2014-1525 The mozilla : :dom : :TextTrack : :AddCue function in Mozilla Firefox before 29.0 and SeaMonkey before 2.26 does not properly perform garbage collection for Text Track Manager variables , which allows remote attackers to execute arbitrary code or cause a denial of service ( use-after-free and heap memory corruption ) via a crafted VIDEO element in an HTML document . ",mozilla : :dom : :TextTrack : :AddCue function ,remote attackers ,Vulnerability,Attacker
"CVE-2014-1531 Use-after-free vulnerability in the nsGenericHTMLElement : :GetWidthHeightForImage function in Mozilla Firefox before 29.0, Firefox ESR 24.x before 24.5, Thunderbird before 24.5, and SeaMonkey before 2.26 allows remote attackers to execute arbitrary code or cause a denial of service ( heap memory corruption ) via vectors involving an imgLoader object that is not properly handled during an image-resize operation . ",Use-after-free vulnerability ,remote attackers ,Vulnerability,Attacker
"CVE-2014-1533 Multiple unspecified vulnerabilities in the browser engine in Mozilla Firefox before 30.0, Firefox ESR 24.x before 24.6, and Thunderbird before 24.6 allow remote attackers to cause a denial of service ( memory corruption and application crash ) or possibly execute arbitrary code via unknown vectors . ",Multiple unspecified vulnerabilities ,remote attackers ,Vulnerability,Attacker
CVE-2014-1537 Use-after-free vulnerability in the mozilla : :dom : :workers : :WorkerPrivateParent function in Mozilla Firefox before 30.0 allows remote attackers to execute arbitrary code or cause a denial of service ( heap memory corruption ) via unspecified vectors . ,Use-after-free vulnerability ,remote attackers ,Vulnerability,Attacker
"CVE-2014-1541 Use-after-free vulnerability in the RefreshDriverTimer : :TickDriver function in the SMIL Animation Controller in Mozilla Firefox before 30.0 , Firefox ESR 24.x before 24.6, and Thunderbird before 24.6 allows remote attackers to execute arbitrary code or cause a denial of service ( heap memory corruption ) via crafted web content . ",Use-after-free vulnerability ,remote attackers ,Vulnerability,Attacker
CVE-2014-1543 Multiple heap-based buffer overflows in the navigator.getGamepads function in the Gamepad API in Mozilla Firefox before 30.0 allow remote attackers to execute arbitrary code by using non-contiguous axes with a ( 1 ) physical or ( 2 ) virtual Gamepad device . ,Multiple heap-based buffer overflows ,remote attackers ,Vulnerability,Attacker
"CVE-2014-1547 Multiple unspecified vulnerabilities in the browser engine in Mozilla Firefox before 31.0, Firefox ESR 24.x before 24.7, and Thunderbird before 24.7 allow remote attackers to cause a denial of service ( memory corruption and application crash ) or possibly execute arbitrary code via unknown vectors . ",Multiple unspecified vulnerabilities ,remote attackers ,Vulnerability,Attacker
"CVE-2014-1549 The mozilla : :dom : :AudioBufferSourceNodeEngine : :CopyFromInputBuffer function in Mozilla Firefox before 31.0 and Thunderbird before 31.0 does not properly allocate Web Audio buffer memory , which allows remote attackers to e xecute arbitrary code or cause a denial of service ( buffer overflow and application crash ) via crafted audio content that is improperly handled during playback buffering . ",The mozilla : :dom : :AudioBufferSourceNodeEngine : :CopyFromInputBuffer function ,remote attackers ,Vulnerability,Attacker
"CVE-2014-1551 Use-after-free vulnerability in the FontTableRec destructor in Mozilla Firefox before 31.0 , Firefox ESR 24.x before 24.7 , and Thunderbird before 24.7 on Windows allows remote attackers to execute arbitrary code via crafted use of fonts in MathML content , leading to improper handling of a DirectWrite font-face object . ",Use-after-free vulnerability ,remote attackers ,Vulnerability,Attacker
"CVE-2014-1581 Use-after-free vulnerability in DirectionalityUtils.cpp in Mozilla Firefox before 33.0 , Firefox ESR 31.x before 31.2 , and Thunderbird 31.x before 31.2 allows remote attackers to execute arbitrary code via text that is improperly handled during the interaction between directionality resolution and layout . ",Use-after-free vulnerability ,remote attackers ,Vulnerability,Attacker
"CVE-2014-1587 Multiple unspecified vulnerabilities in the browser engine in Mozilla Firefox before 34.0, Firefox ESR 31.x before 31.3, Thunderbird before 31.3, and SeaMonkey before 2.31 allow remote attackers to cause a denial of service ( memory corruption and application crash ) or possibly execute arbitrary code via unknown vectors. ",unspecified vulnerabilities ,remote attackers ,Vulnerability,Attacker
"CVE-2014-1593 Stack-based buffer overflow in the mozilla : :FileBlockCache : :Read function in Mozilla Firefox before 34.0, Firefox ESR 31.x before 31.3, Thunderbird before 31.3, and SeaMonkey before 2.31 allows remote attackers to execute arbitrary code via crafted media content . ",buffer overflow ,remote attackers ,Vulnerability,Attacker
"CVE-2014-1595 Mozilla Firefox before 34.0, Firefox ESR 31.x before 31.3, and Thunderbird before 31.3 on Apple OS X 10.10 omit a CoreGraphics disable-logging action that is needed by jemalloc-based applications, which allows local users to obtain sensitive information by reading /tmp files , as demonstrated by credential information . ",CoreGraphics disable-logging action ,local users ,Vulnerability,Attacker
CVE-2014-1597 SQL injection vulnerability in the CMDB web application in synetics i-doit pro before 1.2.5 and i-doit open allows remote attackers to execute arbitrary SQL commands via the objID parameter to the default URI . ,SQL injection vulnerability ,remote attackers ,Vulnerability,Attacker
"CVE-2014-1599 Multiple cross-site scripting ( XSS ) vulnerabilities in the SFR Box router with firmware NB6-MAIN-R3.3.4 allow remote attackers to inject arbitrary web script or HTML via unspecified parameters to ( 1 ) dns , ( 2 ) dhcp , ( 3 ) nat , ( 4 ) route , or ( 5 ) lan in network/ ; or ( 6 ) wifi/config . ",cross-site scripting ( XSS ) vulnerabilities ,remote attackers ,Vulnerability,Attacker
"CVE-2014-1603 Multiple cross-site scripting ( XSS ) vulnerabilities in GetSimple CMS 3.3.1 allow remote attackers to inject arbitrary web script or HTML via the ( 1 ) param parameter to admin/load.php or ( 2 ) user , ( 3 ) email , or ( 4 ) name parameter in a Save Settings action to admin/settings.php . ",cross-site scripting ( XSS ) vulnerabilities ,remote attackers ,Vulnerability,Attacker
"CVE-2014-1609 Multiple SQL injection vulnerabilities in MantisBT before 1.2.16 allow remote attackers to execute arbitrary SQL commands via unspecified parameters to the (1) mc project get function in api/soap/mc project the (2) news get limited function in core/news the (3) summary print by (4) summary print by (5) summary print by (6) summary print by or (7) summary print by function in core/summary the (8) create bug enum or (9) enum bug function in plugins/MantisGraph/core/graph (10) bug graph or (11) bug graph in plugins/MantisGraph/pages/; or (12) proj doc related to use of the db function, a different vulnerability than CVE-2014-1608. ",SQL injection vulnerabilities ,remote attackers ,Vulnerability,Attacker
CVE-2014-1611 Cross-site scripting ( XSS ) vulnerability in the Anonymous Posting module 7.x-1.2 and 7.x-1.3 for Drupal allows remote attackers to inject arbitrary web script or HTML via the contact name field . ,Cross-site scripting ( XSS ) vulnerability ,remote attackers ,Vulnerability,Attacker
CVE-2016-3453 Unspecified vulnerability in Oracle Sun Solaris 10 allows local users to affect availability via vectors related to Kernel . ,Unspecified vulnerability ,local users ,Vulnerability,Attacker
